,title,description,link
0,,,
1,,,
2,,,
3,,,
4,,,
5,,,
6,,,
7,,,
8,,,
9,,,
10,,,
11,UK house price growth approaches stall speed,,https://www.ft.com/content/5f12da7e-f9fb-11e8-af46-2022a0b02a6c
12,Berkeley looks beyond London as Brexit bites and profits tumble,,https://www.ft.com/content/668b42e6-f9f6-11e8-af46-2022a0b02a6c
13,UK financial watchdog proposes permanent CFD clampdown,FCA’s decision is latest blow to online trading sector,https://www.ft.com/content/4eb3e13e-f9f4-11e8-af46-2022a0b02a6c
14,Beyond Brexit: more uncertainty for investors,"Whatever happens in Parliament this week, expect a rollercoaster ride for your finances",https://www.ft.com/content/9ede2d76-f6f3-11e8-af46-2022a0b02a6c
15,"Votes for women, a welfare crisis and today’s tax culture",We can expect more stealth charges on wealth like the new probate fees,https://www.ft.com/content/f6f8d310-f975-11e8-af46-2022a0b02a6c
16,"Brexit explained: you asked, our experts answered","Who are the winners and losers, and is there any way Brexit won't happen? FT writers answer your questions",https://www.ft.com/video/edbb56b5-7bdf-4647-9933-e603f3c4f473
17,Huawei caves in to UK’s security demands,Commitment by Chinese telecoms group follows arrest of its CFO in Canada,https://www.ft.com/content/fd69e2a4-f97d-11e8-8b7c-6fa24bd5409c
18,Leave campaign plans quietly for second referendum,Lynton Crosby aide working behind the scenes with Eurosceptics on strategy for new vote,https://www.ft.com/content/080d418a-f887-11e8-8b7c-6fa24bd5409c
19,Brexit backstop dispute reopens Scottish question,SNP says deal gives Northern Ireland advantage as Tories worry about UK integrity,https://www.ft.com/content/cc488f7c-f81f-11e8-af46-2022a0b02a6c
20,O2 says 4G network service restored after outage,Millions of UK customers were left without data access,https://www.ft.com/content/95f860a2-f9d0-11e8-af46-2022a0b02a6c
21,Doubts raised on ‘settled status’ of UK’s EU citizens,Plan for stricter cut-off point as MPs hear of ‘hair-raising’ fallout from no deal,https://www.ft.com/content/68a5daca-f97c-11e8-af46-2022a0b02a6c
22,Financial services exports to EU face 59% fall,"Post-Brexit trading barriers will force ‘economic activity to relocate’, says report",https://www.ft.com/content/b5fc4a56-f978-11e8-af46-2022a0b02a6c
23,Companies face easier exits from pension schemes,New superfund rules will provide cheaper way of offloading defined benefit plans,https://www.ft.com/content/1bbb26a4-f975-11e8-af46-2022a0b02a6c
24,"UK employers pick EU staff for quality, not cost",IoD study casts doubt on May’s post-Brexit immigration plans for high-skilled workers,https://www.ft.com/content/e178f896-f955-11e8-8b7c-6fa24bd5409c
25,Motability chief to step down over ‘generous’ bonuses,National auditor censures Mike Betts and disabled transport provider’s £1bn profit,https://www.ft.com/content/ce3bfc5e-f975-11e8-af46-2022a0b02a6c
26,UK to create passenger charter as part of aviation strategy,,https://www.ft.com/content/9adb6554-f9aa-11e8-af46-2022a0b02a6c
27,Senior Conservatives urge May to delay Brexit vote,No 10 tries to head off rebellion as backbench Tory group warns opposition is solid,https://www.ft.com/content/13203b50-f92b-11e8-af46-2022a0b02a6c
28,Vehicle hires face extra security in terror clampdown,Code aims to prevent cars and vans being used as potential weapons,https://www.ft.com/content/a32da69e-f96a-11e8-8b7c-6fa24bd5409c
29,Army takes over common land in first enclosure in century,Cumbria council votes to deregister military training area despite fierce opposition,https://www.ft.com/content/4abec6a4-f96b-11e8-af46-2022a0b02a6c
30,European stocks suffer worst slide since Brexit vote,"London, French and German benchmark indices down 3%",https://www.ft.com/content/3e17b7a4-f979-11e8-8b7c-6fa24bd5409c
31,Mark Drakeford set to become next first minister of Wales,,https://www.ft.com/content/c92aacfc-f974-11e8-af46-2022a0b02a6c
32,Brexit: all you need to know about the meaningful vote,The scenarios that could play out after MPs vote on the Brexit agreement,https://www.ft.com/video/fe20efc8-164e-444b-9513-71cf8ef1ba05
33,Apprenticeship levy funding curbs threaten to hit MBA courses,Business group describes the UK government’s plans as an attack on management training,https://www.ft.com/content/62ec2052-f950-11e8-8b7c-6fa24bd5409c
34,Barricades in Paris make bankers think again,Frankfurt suddenly looks more attractive amid the ‘gilets jaunes’ protests,https://www.ft.com/content/7997d508-f8ba-11e8-af46-2022a0b02a6c
35,Norway Plus versus a second referendum,"If Theresa May’s deal dies, MPs will be left with only two alternatives to a disorderly exit",https://www.ft.com/content/ba337e7c-f951-11e8-8b7c-6fa24bd5409c
